Category,Element,Description,Industry Standard,Common Values,Source Systems,Procore Coverage,Benchmarking Use,Notes
Procurement & Contracts,Procurement Manager,"Manages the procurement process from bid solicitation through contract execution — bid package development, bid solicitation, bid leveling, scope review, contract negotiation, insurance and bonding verification. Active from Preconstruction through Procurement; extends into Construction for POs. Decision authority: Medium — recommends awards; negotiates contracts; does not authorize commitments without PM/PE approval.","ISM (Institute for Supply Management); AGC (procurement standards)","Procurement manager; buyout manager; purchasing manager","Procore (bidding, commitments, vendors, insurance); Building Connected; SmartBid; PlanHub; Excel","Medium — bidding and commitment modules support procurement workflows; vendor prequalification available; bid tables not in analytics gold layer",Compare buyout completion timelines and bid coverage rates across project sizes and delivery methods,"On large projects, a dedicated role. On smaller projects, PM handles procurement. Early procurement of long-lead items is schedule-critical. Cross-domain: Organizations (Trade Contractors), Financial Instruments (Commitments)."
Procurement & Contracts,Contract Administrator,"Manages contract compliance and commercial processes after execution — change order processing, pay application review, lien waiver collection, insurance certificate tracking, retainage management. Active from Construction through Closeout. Decision authority: Low-Medium — processes commercial transactions; ensures compliance; does not authorize scope or cost changes.","AIA A201 (contract administration); CMAA; state lien law","Contract admin; CA; commercial manager; contracts manager","Procore (commitments, change orders, pay applications, insurance, lien waivers); Sage 300; Viewpoint; Textura; CMiC","Medium — Procore financial modules (commitments, change orders, pay apps, insurance tracking) support contract admin workflows",Compare change order processing times and lien waiver collection completeness rates across project types,"Often combined with APM role on mid-size projects. The commercial backbone of the project. Cross-domain: Financial Instruments (all commercial instruments), Organizations (Trade Contractors)."
"--- COMMISSIONING & STARTUP: personnel managing systems verification ---",,,,,,,,
Commissioning & Startup,Commissioning Agent (CxA),"Independent professional who verifies building systems perform as designed — commissioning plan development, pre-functional testing, functional performance testing, deficiency tracking, seasonal testing, final report. Not part of design or construction team. Active from Construction through Post-Construction (seasonal). Decision authority: Medium — identifies deficiencies and requires correction; does not authorize design changes or additional cost.","ASHRAE Guideline 0; ASHRAE 202; LEED EAp1; BCxA certification (BCA); ACG certification","CxA; commissioning agent; commissioning authority; Cx manager","Procore (observations, inspections); Cx Alloy; FacilityONE; CxPlanner; BAS systems","Low — observations and inspections can informally track CxA findings; no dedicated commissioning workflow or role classification",Compare commissioning deficiency rates and seasonal test completion timelines across building types,"CxA independence is key — represents owner's interest in system performance. LEED requires CxA. Enhanced CxA extends to envelope. Cross-domain: Organizations (CxA firm), Phases (Commissioning)."
Commissioning & Startup,TAB Technician,"Testing, Adjusting, and Balancing technician who measures and adjusts air and water flow rates to design values — air system balancing, hydronic balancing, sound and vibration measurement. TAB firm independence from MEP contractor is important for objectivity. Active during Commissioning phase. Decision authority: Low — measures and adjusts to design values; reports deficiencies; does not redesign systems.","AABC (certification); NEBB (certification); ASHRAE 111 (testing and balancing)","TAB technician; TAB engineer; air balance technician; water balance technician","TAB instruments (flow hoods, manometers, balometers); BAS systems; Procore (observations — informal)","None — TAB activity not tracked in Procore; TAB reports stored as documents only",Compare TAB deficiency rates and re-balancing frequency across building types and HVAC complexity,"TAB data is foundational — HVAC commissioning depends on balanced systems. Results directly affect occupant comfort. Cross-domain: Phases (Testing Adjusting & Balancing), Building Elements (HVAC)."
"--- OFFICE & ADMINISTRATIVE: personnel supporting project operations ---",,,,,,,,
Office & Administrative,Office Manager / Project Admin,"Manages the project office and administrative operations — office operations, filing, correspondence management, meeting scheduling, visitor management, event coordination. Active across all phases. Decision authority: Low — supports project operations; does not make construction or commercial decisions.","No specific industry standard — general office management","Office manager; project admin; project coordinator; admin assistant","Procore (meeting minutes, correspondence, daily log visitors); office management tools; MS Office; scheduling tools","Low — Procore meeting and correspondence modules capture admin output; no office manager role tracking",Compare administrative support ratios (admin staff per project team size) across project sizes,"On large projects, a dedicated role managing a trailer with 10-30 people. On smaller projects, admin tasks fall to APM or PE."
Office & Administrative,Accountant / Financial Analyst,"Manages project financial transactions and reporting — invoice processing, pay application processing, job cost tracking, financial reporting, audit support, tax compliance. Company-level role supporting multiple projects. Active across all phases. Decision authority: Low — processes financial data; does not authorize expenditures (PM/PE authorize).","AICPA; state CPA requirements; construction-specific accounting (percentage of completion)","Project accountant; financial analyst; AP/AR; cost accountant; controller (project)","Procore (pay applications, invoices, commitments); Sage 300; Viewpoint Vista; CMiC; Foundation; QuickBooks","Medium — Procore financial modules (pay apps, invoices, commitments) feed accounting workflows; integration with ERP systems common",Compare invoice processing cycle times and financial reporting timeliness across project types,"On large projects, may have dedicated project accountant. Financial close each month drives reporting cadence. Cross-domain: Financial Instruments (billing and payment)."
"--- STANDARD MEASURES: KPIs and metrics derived from role performance and staffing ---",,,,,,,,
Standard Measures,Staffing Ratio,"Ratio of management staff (PM, super, PE, APM) to project value or subcontractor count — indicates project resourcing adequacy. Calculated as management headcount / project value band or management headcount / active subcontractor count.","PMI PMBOK (resource management); AGC staffing benchmarks","Typical: 1 PM per $20-50M; 1 super per 10-15 active subs; 1 APM per 8-12 trades managed","Procore (project_role_memberships, project_users); HR systems; staffing tools","High — project_role_memberships and project_users provide headcount per role per project",Compare staffing ratios across project types and value bands to identify under/over-resourced projects,"Under-staffed projects correlate with higher deficiency rates, slower RFI response, and more schedule slippage."
Standard Measures,Role Coverage Rate,"Percentage of key project roles filled at any point in the project timeline — filled roles / required roles × 100. Tracks gaps in project team staffing that create risk.","PMI PMBOK; AGC project staffing standards","Expressed as percentage; target: 100% for core roles (PM, super, safety); typical: 85-95%","Procore (project_role_memberships); HR systems; staffing tools","High — project_role_memberships shows which roles are assigned per project; gaps detectable by missing role assignments",Compare role coverage rates across project types and identify which roles are most frequently vacant,"Safety manager and QC roles are the most commonly vacant on mid-size projects. Cross-domain: Organizations (staffing responsibility)."
Standard Measures,PM Workload Index,"Number of active projects per project manager — indicates workload balance and risk of attention dilution. Calculated from PM role assignments across the active project portfolio.","PMI (resource management); CMAA (CM staffing)","Typical: 1-2 projects (large/complex); 2-4 projects (mid-size); 3-6 projects (small)","Procore (project_role_memberships across projects); HR systems; portfolio tools","High — project_role_memberships enables cross-project PM assignment analysis",Compare PM workload distribution and correlate with project performance outcomes (cost growth, schedule variance),"PMs managing too many projects show degraded performance across all projects. Cross-domain: Project Attributes (project size and complexity)."
Standard Measures,Superintendent Span of Control,"Number of active subcontractors and direct reports managed by a single superintendent — indicates field coordination burden. Calculated from active vendor count and crew headcount per superintendent.","AGC (field management staffing); OSHA competent person requirements","Typical: 8-15 active subs per super (manageable); 15-25 (stretched); 25+ (high risk)","Procore (project_vendors, daily_log_manpower, project_role_memberships); field management tools","High — project_vendors count and project_role_memberships superintendent assignments enable calculation",Compare superintendent span of control and correlate with safety incident rates and daily log completion rates,"High span of control correlates with lower daily log compliance, more safety incidents, and more punch items. Cross-domain: Field Operations, Quality & Safety Records."
Standard Measures,Safety Staffing Ratio,"Ratio of dedicated safety personnel to total workforce — safety staff headcount / peak daily workforce × 100. Indicates safety program investment and correlates with incident rates.","OSHA recommendations; company safety programs; owner safety requirements","Typical: 1 safety person per 50-100 workers; owner requirements may be stricter (1:25 on some projects)","Procore (project_role_memberships — safety roles, daily_log_manpower — peak headcount); safety management systems","Medium — project_role_memberships tracks safety manager; daily_log_manpower provides peak workforce; but safety officer count may be incomplete",Compare safety staffing ratios and correlate with TRIR and observation density across project types,"Higher safety staffing ratios consistently correlate with lower incident rates. Cross-domain: Quality & Safety Records, Recurring Violations (insight #11)."
