Category,Element,Description,Industry Standard,Common Values,Source Systems,Procore Coverage,Benchmarking Use,Notes
"--- PROJECT LEADERSHIP: executives and managers who run the project ---",,,,,,,,
Project Leadership,Owner's Representative,"Owner's on-site or dedicated agent who makes decisions on the owner's behalf — design review, scope decisions, change authorization, acceptance of work, dispute resolution, stakeholder management. Consumes budget reports, schedule updates, change requests, pay applications. Produces change authorizations, design approvals, acceptance letters, field directives. Active across all phases from conception through warranty. Decision authority: High — authorized to make binding decisions for owner on scope, cost, and schedule.","CMAA (owner representation standards); AIA A201 (owner's role); PMI PMP","Owner's rep; OR; owner's PM; client representative","Procore (project_users, project_role_memberships); Primavera Unifier; Kahua; e-Builder; Excel","Medium — tracked in project_role_memberships and project_users; role_name may include Owner's Rep but not consistently classified",Compare owner's rep decision response times and change authorization turnaround across project types,"Scope of authority varies by contract — some can authorize changes up to a threshold, others must escalate. Critical gatekeeper. Cross-domain: Organizations (Owner/Developer), Financial Instruments (change authorization)."
Project Leadership,Project Executive,"Senior leader overseeing a project or group of projects for the GC or CM — portfolio oversight, client relationship, risk escalation, financial performance, resource allocation, contract negotiations. Consumes monthly financial reports, schedule summaries, risk registers. Produces executive summaries, escalation decisions, resource commitments. Active across all phases with higher involvement during procurement and major milestones. Decision authority: High — approves GMP, major change orders, staffing.","PMI PMP/PgMP; AGC project executive standards","Project exec; PE; VP of operations; division manager","Procore (project_users); ERP systems (Sage, Viewpoint, CMiC); Excel","Low — tracked in project_users but no structured PE role classification; PE activity not captured in daily workflows",Compare PE portfolio span (projects per PE) and escalation frequency across company sizes,"Typically manages 2-5 projects simultaneously. The PE is the GC's senior relationship with the owner. Gets involved for major decisions and problem resolution."
Project Leadership,Project Manager,"Day-to-day leader of the project — owns schedule, budget, and subcontractor management. Consumes daily reports, budget/schedule updates, RFIs, submittals, change events, pay applications. Produces monthly reports, budget forecasts, schedule updates, meeting minutes, change order packages. Active from Procurement through Closeout. Decision authority: Medium-High — manages budget and schedule; recommends changes; escalates major issues to PE.","PMI PMP; CMAA CCM; AGC project management standards","PM; project manager; construction manager (on owner side)","Procore (primary user — all modules); Sage 300; Viewpoint Vista; CMiC; MS Project; P6; Excel","High — project_role_memberships tracks PM role (role_name = 'Project Manager'); PM is the primary Procore power user across all modules",Compare PM workload (projects per PM) and project performance (cost growth, schedule variance) across project types,"The central hub of project information — PM touches every UCDM domain. GC PM vs. owner PM have different perspectives but both need the same data. Cross-domain: all domains."
Project Leadership,Assistant Project Manager,"Supports PM with day-to-day management — often assigned specific scope areas or administrative functions. Manages submittal tracking, RFI coordination, subcontract administration, insurance tracking, meeting coordination, document control. Active from Procurement through Closeout. Decision authority: Low-Medium — executes PM decisions; manages defined scope areas; limited authorization for minor changes.","PMI CAPM; AGC; CMAA","APM; assistant PM; junior PM","Procore (submittals, RFIs, commitments, correspondence, document management); Sage 300; Viewpoint; Excel","Medium — tracked in project_users; may have project_role_memberships entry; APM is a heavy Procore user but role not always distinguished from PM",Compare APM scope coverage (trades managed per APM) and administrative task completion rates,"Career progression: APM → PM → PE. The APM role is where most people learn construction management. Typically assigned specific trades. Cross-domain: Documents (submittals, RFIs), Financial Instruments (subcontract admin)."
Project Leadership,Design Manager,"Manages the design process and design team coordination for the GC or owner — design review, constructability review, design schedule management, value engineering. Primarily a design-build or CM at Risk role. Active during Preconstruction; extends into Construction for design-build. Decision authority: Medium — recommends design decisions; manages design consultants; does not stamp drawings.","AIA (design phase standards); DBIA (design-build management); AGC","Design manager; VDC director; preconstruction design lead","Procore (RFIs, submittals, drawings, coordination issues); BIM 360; Revit; Bluebeam; Newforma","Low — not a standard project_role_memberships role; design manager activity captured indirectly through RFI/submittal workflows",Compare design review turnaround times and constructability issue identification rates across delivery methods,"Bridges the gap between design intent and construction reality. Manages the A/E team on behalf of the GC. Cross-domain: Organizations (Design Team), Phases (Design Development)."
"--- FIELD OPERATIONS: personnel who manage work on the jobsite ---",,,,,,,,
Field Operations,Superintendent,"Senior field leader responsible for day-to-day construction operations — trade coordination, schedule enforcement, quality oversight, safety enforcement, site logistics, daily reporting. Consumes lookaheads, daily logs, inspection schedules, safety reports, coordination notes, drawing sets. Produces daily reports, coordination schedules, field directives, site logistics plans. Active from Construction through Closeout. Decision authority: Medium-High — controls site access, work sequence, schedule priorities; can stop unsafe work.","OSHA 29 CFR 1926 (competent person requirements); AGC (field management)","Superintendent; super; site manager; general superintendent","Procore (daily logs — primary creator, inspections, observations, punch items, schedule); Raken; Fieldwire; PlanGrid","High — project_role_memberships tracks superintendent role; super is the primary daily log creator and field Procore user",Compare superintendent span of control (subcontractors per super) and daily reporting compliance rates,"The superintendent owns the field — everything on site flows through the super. Typically the most experienced person on the project. Cross-domain: Field Operations (daily logs), Phases (all construction phases)."
Field Operations,Assistant Superintendent,"Supports superintendent with field coordination — often assigned to specific building areas or trades. Manages area-specific trade coordination, daily documentation, inspection coordination, material tracking, quality walks. Active from Construction through Closeout. Decision authority: Low-Medium — manages assigned area; escalates issues to superintendent.","OSHA 29 CFR 1926; AGC","Assistant super; area super; assistant superintendent","Procore (daily logs, inspections, observations, punch items); Raken; Fieldwire; PlanGrid","Medium — tracked in project_users; may appear in project_role_memberships; creates daily logs and field records for assigned areas",Compare assistant superintendent area assignments and deficiency identification rates per area,"Often assigned specific floors, areas, or trade groups. Career path to superintendent. May have 1-3 areas depending on project size."
Field Operations,Project Engineer,"Technical field support — manages engineering and documentation aspects of field work. Drafts RFIs, coordinates submittals, tracks as-builts, reviews shop drawings, tracks quantities, solves technical problems. Bridge between office (PM team) and field (super team). Active from Construction through Closeout. Decision authority: Low — identifies issues and proposes solutions; does not authorize changes.","PMI; AGC; AACE (project controls)","PE (field); project engineer; field office engineer","Procore (RFIs, submittals, daily logs, as-built markups); Bluebeam; Excel; BIM tools","Medium — tracked in project_users; creates RFIs, manages submittals in Procore; role not always distinguished in project_role_memberships",Compare project engineer RFI drafting rates and submittal processing turnaround across project types,"Often the first to identify technical conflicts. Strong career development role. Cross-domain: Documents (RFIs, submittals), Building Elements (technical issues)."
Field Operations,Field Engineer,"Entry-level field position focused on surveying, layout, and construction documentation — concrete placement monitoring, quantity verification, material receiving, photo documentation. Starting point for most construction careers. Active during Construction. Decision authority: Low — executes technical tasks under supervision; flags discrepancies.","OSHA 10/30 (safety training); survey instrument certifications","Field engineer; junior engineer; layout engineer","Procore (daily logs, photos, material receiving); survey instruments (Trimble, Topcon, Leica); Bluebeam","Low — tracked in project_users but field engineer role rarely classified in project_role_memberships; photo and daily log contributions tracked",Compare field engineer documentation volume and discrepancy identification rates across project types,"Gets hands dirty — learns how buildings actually go together. Transitions to PE or assistant super. Cross-domain: Field Operations (daily documentation)."
Field Operations,Foreman / General Foreman,"Trade-specific field leader who manages a crew of 4-20 workers on a daily basis — daily work assignments, material coordination, quality of installed work, safety compliance, productivity. The link between management and craft workers. Active from Construction through Closeout. Decision authority: Low — manages own crew's daily work; escalates to super or PM.","OSHA 29 CFR 1926 (competent person); union agreements (foreman classification); trade-specific certifications","Foreman; general foreman; GF; lead hand; working foreman","Procore (daily logs — may submit for crew, T&M tickets); timekeeping systems; subcontractor field apps","Medium — daily_log_construction_reports tracks foreman_hours; daily_log_manpower captures crew-level data; foreman not individually classified",Compare foreman crew sizes and crew productivity rates across trades and project types,"A good foreman maximizes crew productivity. Cross-domain: Resources (Trades), Field Operations (manpower tracking)."
Field Operations,Journeyman / Craft Worker,"Skilled tradesperson who performs the physical construction work — licensed or certified in their trade. Installs trade-specific work per drawings and specs, maintains quality workmanship, complies with safety procedures. The people who actually build the building. Active during Construction. Decision authority: None — executes work as directed; reports unsafe conditions.","State licensing (electricians, plumbers); OSHA 10 (safety); union journeyman certification; trade-specific certifications","Journeyman; mechanic; tradesman; craft worker; skilled laborer","Procore (daily logs — reported by foreman/super); timekeeping systems; union dispatch systems","Medium — daily_log_construction_reports tracks journeyman_hours and headcounts; daily_log_manpower captures individual or crew-level data",Compare journeyman headcount trends and labor productivity across trades and project phases,"Licensed electricians, plumbers, ironworkers, operators, etc. Union or non-union. Apprenticeship programs feed the pipeline. Cross-domain: Resources (Trades)."
Field Operations,Apprentice,"Trades worker in training — learning under journeyman supervision as part of a formal 3-5 year program. Performs assigned tasks, attends trade school, progresses toward journeyman status. Active during Construction. Decision authority: None — works under direct journeyman supervision. Apprentice-to-journeyman ratio is regulated.","DOL (Department of Labor — registered apprenticeship); state apprenticeship standards; union apprenticeship programs","Apprentice; first-year through fourth-year; indentured apprentice","Procore (daily logs — reported as crew); timekeeping systems; apprenticeship management systems; union training centers","Medium — daily_log_construction_reports tracks apprentice_hours separately; headcount captured in manpower logs",Compare apprentice utilization rates and apprentice-to-journeyman ratios across trades and project types,"Formal apprenticeship programs are the primary skilled labor pipeline. Required on many public projects with workforce development mandates. Cross-domain: Resources (Trades)."
"--- SAFETY & QUALITY: personnel responsible for safety compliance and quality assurance ---",,,,,,,,
Safety & Quality,Safety Manager / Safety Director,"Dedicated safety professional responsible for the project's or company's safety program — site inspections, incident investigation, OSHA compliance, safety training, subcontractor safety oversight. Consumes OSHA regulations, safety plans, incident reports, observation reports, EMR data. Produces safety metrics (TRIR, DART, EMR), corrective actions, training records. Active primarily during Construction; extends into Preconstruction for planning. Decision authority: Medium — can stop unsafe work immediately; recommends corrective actions.","OSHA 29 CFR 1926; ANSI Z10 (safety management); BCSP CSP/CHST certifications","Safety manager; safety director; HSE manager; EHS director","Procore (observations — safety, daily log safety violations, incidents); Safety Reports; iAuditor; SiteDocs; Predictive Solutions","Medium — project_role_memberships tracks Safety Manager role (confirmed in data mapping); safety observations and incidents capture activity",Compare safety manager-to-worker ratios and TRIR outcomes across project types and sizes,"On large projects, full-time dedicated. On smaller projects, superintendent may double as safety. Third-party consultants common. Cross-domain: Quality & Safety Records, Recurring Violations (insight #11)."
Safety & Quality,Safety Officer / Safety Coordinator,"Field-level safety personnel conducting daily site safety activities — safety walks, toolbox talks, new worker orientation, PPE compliance, housekeeping inspections, near-miss documentation. Boots-on-the-ground safety presence. Active during Construction. Decision authority: Low-Medium — can stop unsafe work; reports to safety manager.","OSHA 29 CFR 1926; BCSP OHST/STS certifications; OSHA 30-hour","Safety officer; safety coordinator; site safety; safety tech","Procore (observations — safety, daily logs); safety management apps; inspection checklists","Low — may be tracked in project_users but no dedicated safety officer role in project_role_memberships; activity captured through safety observations",Compare safety observation volume per safety officer and near-miss reporting rates across projects,"Multiple safety officers on large projects. Subcontractor safety officers supplement GC staff. Cross-domain: Quality & Safety Records (observations)."
Safety & Quality,Quality Manager / QC Inspector,"Dedicated quality professional responsible for QA/QC across the project — inspection coordination, deficiency tracking, specification compliance, material testing coordination, non-conformance management. Consumes specifications, approved submittals, test reports, inspection results. Produces inspection reports, NCRs, deficiency logs, quality metrics. Active from Construction through Closeout. Decision authority: Medium — can reject non-conforming work; requires corrective action.","ISO 9001 (quality management); ASQ CQM/CQE certifications; project-specific quality plans","QC manager; quality manager; QA/QC inspector; quality engineer","Procore (inspections, observations — quality, punch items); quality management systems; Bluebeam","Medium — inspections and observations track QC activity; project_role_memberships may include QC roles; no dedicated quality management workflow",Compare quality inspection pass rates and NCR frequency across project types and complexity levels,"Dedicated QC roles more common on large/complex projects (healthcare, data centers, federal). On typical commercial, quality falls to super and PE. Cross-domain: Quality & Safety Records."
"--- PRECONSTRUCTION & ESTIMATING: personnel who plan the project before construction ---",,,,,,,,
Preconstruction & Estimating,Estimator / Chief Estimator,"Develops cost estimates from conceptual through detailed pricing — quantity takeoff, unit pricing, subcontractor bid solicitation and leveling, risk pricing, GMP development, value engineering. Consumes drawings, specifications, bid documents, historical cost data, subcontractor bids. Produces cost estimates, bid proposals, GMP packages, VE logs, bid tabulations. Active during Preconstruction. Decision authority: Medium — cost opinions inform major decisions; recommends contingency levels.","AACE CEP (certified estimating professional); ASPE (American Society of Professional Estimators)","Estimator; chief estimator; senior estimator; cost estimator","Procore (Estimating, bidding); On-Screen Takeoff; Planswift; HCSS HeavyBid; Sage Estimating; ProEst; Excel","Medium — Procore Estimating tables exist (estimates, estimate_layers); bidding module supports bid solicitation; adoption growing",Compare estimate accuracy (estimate vs. actual) and bid hit rates across project types and estimators,"Estimating is where projects are won or lost. Accuracy depends on experience and historical data. Conceptual ±20%, detailed ±5%. Cross-domain: Financial Instruments (budget origination)."
Preconstruction & Estimating,Preconstruction Manager,"Leads the preconstruction effort — coordinates estimating, scheduling, constructability, client presentations, GMP negotiation, value engineering facilitation, risk assessment, subcontractor prequalification. Active during Preconstruction. Decision authority: Medium-High — leads GMP development; recommends scope and budget decisions; negotiates with owner.","CMAA; DBIA (design-build preconstruction); AGC CM/GC preconstruction standards","Precon manager; preconstruction director; BD/precon lead","Procore (Estimating, bidding, schedule); Building Connected (prequalification); P6; MS Project; Excel","Low — no dedicated preconstruction manager role in project_role_memberships; precon activity spans estimating and bidding modules",Compare GMP development timelines and win rates across delivery methods and project types,"The GC's lead during the pre-award phase. Win rate depends on ability to build trust with owner and architect. Cross-domain: Organizations (CM at Risk), Phases (Preconstruction)."
"--- PROJECT CONTROLS: personnel who manage schedule, cost, and risk data ---",,,,,,,,
Project Controls,Scheduler / Project Controls Manager,"Manages the project schedule and schedule-related analytics — schedule development, updates, critical path analysis, delay analysis, resource loading, earned value management, schedule risk assessment. Active across all phases from preconstruction through closeout. Decision authority: Medium — schedule analysis informs decisions but does not authorize them; provides forensic basis for claims.","AACE PSP (planning and scheduling professional); PMI-SP (scheduling professional); Guild of Project Controls","Scheduler; planner; project controls manager; planning engineer","Procore (schedule_task, schedule_lookahead); Oracle P6; MS Project; Asta Powerproject; Primavera Risk Analysis; Deltek","Medium — schedule_task and schedule_lookahead tables exist; schedule_task_changes tracks deltas; but no resource loading or earned value",Compare schedule update frequency and critical path stability across project types and scheduling tools,"Schedule management ranges from basic bar charts (small) to full P6 with EVM (large). Delay analysis expertise is critical for claims. Cross-domain: Schedule (all elements), Phases (milestone tracking)."
Project Controls,Document Controller,"Manages the project document management system — document numbering, drawing distribution, revision control, submittal routing, RFI routing, transmittal management, archiving. Active across all phases. Decision authority: Low — manages process and routing; does not make content decisions.","CSI (document management standards); ISO 9001 (document control); AIA (document numbering)","Document controller; DC; document manager; records manager","Procore (documents, drawings, submittals, RFIs, transmittals); Aconex; ProjectWise; Newforma; SharePoint; BIM 360 Docs","Medium — Procore document management, drawing revision tracking, and transmittal modules support DC workflows; no dedicated DC role tracking",Compare document control compliance rates and revision distribution timeliness across project types,"On large projects, a full-time role. On smaller projects, the APM handles it. Discipline (or lack thereof) affects every other role. Cross-domain: Documents & Communications (all elements)."
Project Controls,Cost Engineer / Cost Analyst,"Tracks and forecasts project costs — cost tracking, forecast updates, change order impact analysis, cash flow projections, earned value analysis, budget variance reporting. More common on large projects ($50M+). Active from Procurement through Closeout. Decision authority: Low-Medium — provides financial analysis; recommends cost actions; does not authorize expenditures.","AACE CCE (certified cost engineer); AACE EVP; PMI PMP (cost management)","Cost engineer; cost analyst; project controls analyst; financial analyst (project)","Procore (budget, commitments, change orders, pay applications); Sage 300; Viewpoint Vista; CMiC; Excel; EcoSys","Medium — Procore financial modules (budget, commitments, change orders, pay apps) provide cost tracking data; no native earned value or forecasting",Compare cost forecast accuracy and budget variance trends across project types and cost engineer involvement,"Cost engineering and scheduling increasingly converge in project controls. On smaller projects, the PM handles cost management directly. Cross-domain: Financial Instruments (all cost surfaces)."
"--- BIM & TECHNOLOGY: personnel managing digital models and technology ---",,,,,,,,
BIM & Technology,BIM Manager / VDC Coordinator,"Manages the building information model and virtual design and construction processes — BIM execution plan, model management, clash detection, trade coordination, 4D scheduling, quantity extraction, reality capture management. Bridges design and construction. Active from Preconstruction through Closeout. Decision authority: Medium — drives coordination decisions; model is the authority for spatial coordination.","AIA E203 (BIM protocol); BIMForum LOD Spec; AGC BIM education; buildingSMART (IFC/openBIM)","BIM manager; VDC coordinator; VDC manager; BIM lead; digital construction manager","Procore (coordination issues, models, drawings); Navisworks; BIM 360; Revit; Trimble Connect; Synchro","Medium — coordination_issue table captures BIM-driven coordination; models can be linked; but no native BIM model management in Procore",Compare clash detection rates and coordination issue resolution times across project sizes and BIM maturity levels,"BIM/VDC roles are standard on projects over $20M. LOD specification governs model reliability. Cross-domain: Phases (Above-Ceiling Coordination), Building Elements (all systems)."
BIM & Technology,Technology Manager,"Manages project technology infrastructure — software deployment, mobile device management, network infrastructure, system integration, data management, user training. Increasingly important as construction becomes more technology-dependent. Active across all phases. Decision authority: Low — enables technology; does not make construction decisions.","CompTIA; ITIL; construction-specific IT certifications","IT manager; technology director; construction technology manager","Procore (administration, integrations); enterprise IT systems; MDM platforms; cloud services","Low — Procore admin and integration settings; technology manager role not tracked in project_role_memberships",Compare technology adoption rates and system utilization across project types and company sizes,"Field tablets, drones, 360 cameras, IoT sensors all require technology management. Cross-domain: all domains (technology enables data capture across every domain)."
"--- PROCUREMENT & CONTRACTS: personnel managing commercial relationships ---",,,,,,,,
